{
  "schema": "acef.control-dosing.v2",
  "version": "2026-07-31",
  "retiredAdmissions": [
    "direct"
  ],
  "controls": [
    {
      "id": "worker-scope",
      "primaryFailureMode": "Scope escape before or during writes.",
      "role": "active-enforcement",
      "trustCeiling": "mechanical",
      "workflowDoses": {
        "quick-fix": {
          "requirement": "required",
          "dose": "compact",
          "enforcementLevel": "hook",
          "backstop": "Human diff review is weaker because it happens after the write."
        },
        "lightweight": {
          "requirement": "required",
          "dose": "compact",
          "enforcementLevel": "hook",
          "backstop": "Human diff review is weaker because it happens after the write."
        },
        "full-bmad": {
          "requirement": "required",
          "dose": "full",
          "enforcementLevel": "hook",
          "backstop": "No cheaper backstop catches BMAD scope escape before the write."
        }
      },
      "assuranceDoses": {
        "guarded": {
          "requirement": "required",
          "dose": "full",
          "enforcementLevel": "hook",
          "backstop": "No cheaper backstop catches guarded scope escape before the write."
        }
      }
    },
    {
      "id": "cold-read-current-context",
      "primaryFailureMode": "Chat-memory drift, stale story, wrong phase, or wrong active ledger.",
      "role": "active-guidance",
      "trustCeiling": "cooperative-local",
      "workflowDoses": {
        "quick-fix": {
          "requirement": "required-if-triggered",
          "dose": "light",
          "enforcementLevel": "validator",
          "backstop": "A tight single-context quick fix can use explicit user scope plus focused repro evidence."
        },
        "lightweight": {
          "requirement": "required",
          "dose": "compact",
          "enforcementLevel": "validator",
          "backstop": "Manual conductor ledger checks are slower and easier to skip."
        },
        "full-bmad": {
          "requirement": "required",
          "dose": "full",
          "enforcementLevel": "validator",
          "backstop": "Manual checks are not enough for full-BMAD multi-phase dispatch."
        }
      },
      "assuranceDoses": {
        "guarded": {
          "requirement": "required",
          "dose": "full",
          "enforcementLevel": "validator",
          "backstop": "Manual checks are not enough for guarded multi-actor dispatch."
        }
      }
    },
    {
      "id": "active-run-next-action",
      "primaryFailureMode": "Wrong next action, phase jump, or repeated full-ledger reread.",
      "role": "active-guidance",
      "trustCeiling": "cooperative-local",
      "workflowDoses": {
        "quick-fix": {
          "requirement": "optional",
          "dose": "light",
          "enforcementLevel": "documented",
          "backstop": "Explicit quick-fix envelope and focused evidence can be enough for a tight single-context fix."
        },
        "lightweight": {
          "requirement": "required",
          "dose": "compact",
          "enforcementLevel": "validator",
          "backstop": "Manual next-step checks are slower and less reproducible."
        },
        "full-bmad": {
          "requirement": "required",
          "dose": "full",
          "enforcementLevel": "validator",
          "backstop": "Manual next-step checks are not enough for full-BMAD work."
        }
      },
      "assuranceDoses": {
        "guarded": {
          "requirement": "required",
          "dose": "full",
          "enforcementLevel": "validator",
          "backstop": "Manual next-step checks are not enough for guarded work."
        }
      }
    },
    {
      "id": "actor-records",
      "primaryFailureMode": "Self-review, role collapse, or unverifiable separation.",
      "role": "audit-telemetry",
      "trustCeiling": "audit-only",
      "workflowDoses": {
        "quick-fix": {
          "requirement": "required-if-triggered",
          "dose": "light",
          "enforcementLevel": "audit",
          "backstop": "Real separate-worker topology plus reviewer report, with weaker attribution."
        },
        "lightweight": {
          "requirement": "required-if-triggered",
          "dose": "compact",
          "enforcementLevel": "audit",
          "backstop": "Real separate-worker topology plus reviewer report, with weaker attribution."
        },
        "full-bmad": {
          "requirement": "required",
          "dose": "full",
          "enforcementLevel": "validator",
          "backstop": "Reviewer/conductor reports alone do not make separation auditable."
        }
      },
      "assuranceDoses": {
        "guarded": {
          "requirement": "required",
          "dose": "full",
          "enforcementLevel": "validator",
          "backstop": "Reviewer/conductor reports alone do not make separation auditable."
        }
      }
    },
    {
      "id": "approval-receipts",
      "primaryFailureMode": "Ambiguous continuation text treated as new scope approval.",
      "role": "scope-guard",
      "trustCeiling": "human-confirmed",
      "workflowDoses": {
        "quick-fix": {
          "requirement": "optional",
          "dose": "light",
          "enforcementLevel": "human",
          "backstop": "Fresh explicit user confirmation before widening the quick-fix envelope."
        },
        "lightweight": {
          "requirement": "required-if-triggered",
          "dose": "compact",
          "enforcementLevel": "human",
          "backstop": "Fresh explicit user confirmation before scope expansion."
        },
        "full-bmad": {
          "requirement": "required-if-triggered",
          "dose": "full",
          "enforcementLevel": "validator",
          "backstop": "Fresh explicit user confirmation before epic transition or expansion."
        }
      },
      "assuranceDoses": {
        "guarded": {
          "requirement": "required-if-triggered",
          "dose": "full",
          "enforcementLevel": "validator",
          "backstop": "Fresh explicit user confirmation before guarded start or expansion."
        }
      }
    },
    {
      "id": "evidence-manifest",
      "primaryFailureMode": "Stale output, wrong command, wrong commit, or chat-only evidence.",
      "role": "evidence-guard",
      "trustCeiling": "cooperative-local",
      "workflowDoses": {
        "quick-fix": {
          "requirement": "optional",
          "dose": "light",
          "enforcementLevel": "audit",
          "backstop": "Skeptical disk re-run of focused repro and verification commands."
        },
        "lightweight": {
          "requirement": "optional",
          "dose": "compact",
          "enforcementLevel": "audit",
          "backstop": "Skeptical disk re-run plus lightweight surface evidence."
        },
        "full-bmad": {
          "requirement": "required",
          "dose": "full",
          "enforcementLevel": "validator",
          "backstop": "Manual re-run can audit but should not replace full-BMAD evidence manifests."
        }
      },
      "assuranceDoses": {
        "guarded": {
          "requirement": "required",
          "dose": "full",
          "enforcementLevel": "validator",
          "backstop": "Manual re-run can audit but should not replace guarded evidence manifests."
        }
      }
    },
    {
      "id": "runner-proof",
      "primaryFailureMode": "Evidence record edited after command or detached from raw output.",
      "role": "evidence-guard",
      "trustCeiling": "cooperative-local",
      "workflowDoses": {
        "quick-fix": {
          "requirement": "optional",
          "dose": "light",
          "enforcementLevel": "audit",
          "backstop": "Skeptical re-run and raw log inspection."
        },
        "lightweight": {
          "requirement": "required-if-triggered",
          "dose": "compact",
          "enforcementLevel": "validator",
          "backstop": "Skeptical re-run and raw log inspection."
        },
        "full-bmad": {
          "requirement": "required",
          "dose": "full",
          "enforcementLevel": "validator",
          "backstop": "Raw log inspection can audit but should not replace full-BMAD runner proof."
        }
      },
      "assuranceDoses": {
        "guarded": {
          "requirement": "required-if-triggered",
          "dose": "compact",
          "enforcementLevel": "validator",
          "backstop": "Skeptical re-run and raw log inspection (v2 thinning: attended guarded flows rely on the re-run backstop; unattended guarded work should trigger runner proof)."
        }
      }
    },
    {
      "id": "gate-verdict",
      "primaryFailureMode": "PASS without required evidence or with the wrong decision actor.",
      "role": "decision-guard",
      "trustCeiling": "cooperative-local",
      "workflowDoses": {
        "quick-fix": {
          "requirement": "optional",
          "dose": "light",
          "enforcementLevel": "documented",
          "backstop": "Manual closeout checklist plus independent review."
        },
        "lightweight": {
          "requirement": "optional",
          "dose": "compact",
          "enforcementLevel": "documented",
          "backstop": "Manual closeout checklist plus independent review."
        },
        "full-bmad": {
          "requirement": "required",
          "dose": "full",
          "enforcementLevel": "validator",
          "backstop": "Manual closeout is weaker for full-BMAD PASS decisions."
        }
      },
      "assuranceDoses": {
        "guarded": {
          "requirement": "required",
          "dose": "full",
          "enforcementLevel": "validator",
          "backstop": "Manual closeout is weaker for guarded PASS decisions."
        }
      }
    },
    {
      "id": "surface-contract",
      "primaryFailureMode": "Fake runtime proof, in-memory persistence, or unreachable UI.",